{"$id":"https://github.com/jotaele44/thehub-pr/schemas/contracts/skywatcher_ai/dual_run_lane_evidence.v1.schema.json","$schema":"https://json-schema.org/draft/2020-12/schema","additionalProperties":false,"properties":{"active_snapshot_promoted":{"const":false},"answer_eligible":{"const":false},"campaign_id":{"pattern":"^dual-run-campaign-sha256-[0-9a-f]{64}$","type":"string"},"certified_state_created":{"const":false},"created_at":{"format":"date-time","type":"string"},"deterministic_outputs":{"items":{"additionalProperties":false,"properties":{"normalized_sha256":{"pattern":"^[0-9a-f]{64}$","type":"string"},"output_id":{"minLength":1,"type":"string"}},"required":["output_id","normalized_sha256"],"type":"object"},"type":"array"},"execution_receipt":{"additionalProperties":false,"properties":{"receipt_sha256":{"pattern":"^[0-9a-f]{64}$","type":"string"},"run_id":{"pattern":"^[0-9a-f]{32}$","type":"string"},"signature_verified":{"const":true}},"required":["run_id","receipt_sha256","signature_verified"],"type":"object"},"h06_job_record_id":{"type":"string"},"h07_admission_receipt_id":{"type":"string"},"input_accounting":{"additionalProperties":false,"properties":{"excluded":{"minimum":0,"type":"integer"},"failed":{"minimum":0,"type":"integer"},"inputs":{"minimum":0,"type":"integer"},"processed":{"minimum":0,"type":"integer"}},"required":["inputs","processed","excluded","failed"],"type":"object"},"lane":{"enum":["LEGACY_SHADOW","ADR0006_CANDIDATE"]},"lane_evidence_id":{"pattern":"^dual-run-lane-sha256-[0-9a-f]{64}$","type":"string"},"legacy_shadow_export_id":{"type":"string"},"missing_required_provenance":{"minimum":0,"type":"integer"},"model_fields":{"items":{"additionalProperties":false,"properties":{"field_key":{"minLength":1,"type":"string"},"provenance":{"additionalProperties":false,"properties":{"access_context_hash":{"pattern":"^[0-9a-f]{64}$","type":"string"},"extraction_schema_version":{"minLength":1,"type":"string"},"model_id":{"minLength":1,"type":"string"},"model_revision":{"minLength":1,"type":"string"},"policy_version":{"minLength":1,"type":"string"},"prompt_template_hash":{"pattern":"^[0-9a-f]{64}$","type":"string"},"provider_id":{"minLength":1,"type":"string"},"source_artifact_id":{"pattern":"^artifact-sha256-[0-9a-f]{64}$","type":"string"},"source_sha256":{"pattern":"^[0-9a-f]{64}$","type":"string"}},"required":["source_artifact_id","source_sha256","provider_id","model_id","model_revision","prompt_template_hash","policy_version","access_context_hash","extraction_schema_version"],"type":"object"},"review_status":{"enum":["REVIEWED","UNRESOLVED_REVIEW"]},"value":{}},"required":["field_key","value","provenance","review_status"],"type":"object"},"type":"array"},"output_accounting":{"additionalProperties":false,"properties":{"failed":{"minimum":0,"type":"integer"},"produced":{"minimum":0,"type":"integer"},"required":{"minimum":0,"type":"integer"}},"required":["required","produced","failed"],"type":"object"},"pins_sha256":{"pattern":"^[0-9a-f]{64}$","type":"string"},"producer_package_id":{"type":"string"},"producer_package_sha256":{"pattern":"^[0-9a-f]{64}$","type":"string"},"schema_version":{"const":"dual_run_lane_evidence.v1"},"schema_violations":{"minimum":0,"type":"integer"},"source_set_sha256":{"pattern":"^[0-9a-f]{64}$","type":"string"},"trial_id":{"minLength":1,"type":"string"}},"required":["schema_version","lane_evidence_id","campaign_id","trial_id","lane","execution_receipt","source_set_sha256","pins_sha256","deterministic_outputs","model_fields","schema_violations","missing_required_provenance","input_accounting","output_accounting","certified_state_created","active_snapshot_promoted","answer_eligible","created_at"],"type":"object"}
