{"active_snapshot_promoted":false,"answer_eligible":false,"campaign_id":"dual-run-campaign-sha256-aaaaaaaaaaaaaaaaaaaaaaaaaaaaaaaaaaaaaaaaaaaaaaaaaaaaaaaaaaaaaaaa","certified_state_created":false,"created_at":"2026-08-09T12:00:00Z","deterministic_outputs":[{"normalized_sha256":"cccccccccccccccccccccccccccccccccccccccccccccccccccccccccccccccc","output_id":"manifest"}],"execution_receipt":{"receipt_sha256":"cccccccccccccccccccccccccccccccccccccccccccccccccccccccccccccccc","run_id":"dddddddddddddddddddddddddddddddd","signature_verified":true},"input_accounting":{"excluded":0,"failed":0,"inputs":1,"processed":1},"lane":"LEGACY_SHADOW","lane_evidence_id":"dual-run-lane-sha256-e2e8239c0772d707bfabcf5c8aac15a66e6b36702e663c90e46b2339f07befb6","legacy_shadow_export_id":"legacy-shadow-export-sha256-b332ed062ec8d73973c33ab925555f29241015c0f110540742cdb349d4cca5e5","missing_required_provenance":0,"model_fields":[{"field_key":"registration","provenance":{"access_context_hash":"cccccccccccccccccccccccccccccccccccccccccccccccccccccccccccccccc","extraction_schema_version":"v1","model_id":"legacy-model","model_revision":"r1","policy_version":"p1","prompt_template_hash":"bbbbbbbbbbbbbbbbbbbbbbbbbbbbbbbbbbbbbbbbbbbbbbbbbbbbbbbbbbbbbbbb","provider_id":"legacy-provider","source_artifact_id":"artifact-sha256-aaaaaaaaaaaaaaaaaaaaaaaaaaaaaaaaaaaaaaaaaaaaaaaaaaaaaaaaaaaaaaaa","source_sha256":"aaaaaaaaaaaaaaaaaaaaaaaaaaaaaaaaaaaaaaaaaaaaaaaaaaaaaaaaaaaaaaaa"},"review_status":"REVIEWED","value":"N123"}],"output_accounting":{"failed":0,"produced":1,"required":1},"pins_sha256":"bbbbbbbbbbbbbbbbbbbbbbbbbbbbbbbbbbbbbbbbbbbbbbbbbbbbbbbbbbbbbbbb","schema_version":"dual_run_lane_evidence.v1","schema_violations":0,"source_set_sha256":"aaaaaaaaaaaaaaaaaaaaaaaaaaaaaaaaaaaaaaaaaaaaaaaaaaaaaaaaaaaaaaaa","trial_id":"trial-fixture"}
